{
  "schema_version": 1,
  "slug": "geography-v2",
  "name": "Geography v2",
  "description": "Open-licensed Geography trivia, volume 2. Generated from the OpenTriviaQA archive and capped at 500 logical notes per Deez nut.",
  "authors": [
    {
      "github": "uberspot",
      "name": "OpenTriviaQA contributors"
    },
    {
      "github": "chrisbirster",
      "name": "Chris Birster"
    }
  ],
  "tags": [
    "trivia",
    "open-trivia-qa",
    "geography"
  ],
  "license": "CC-BY-SA-4.0",
  "source": {
    "type": "github",
    "repository": "chrisbirster/deez-nuts"
  },
  "versions": [
    {
      "version": "1.0.0",
      "commit": "17c68f4b375f2f8df22bdf091c97b7e2afd5a73e",
      "path": "nuts/geography-v2/geography-v2.nut",
      "sha256": "b33184db554c614b1ac0d658622edee9f79a267acf710e1ef39f098032e5b83c"
    }
  ]
}
