{
  "schema_version": 1,
  "slug": "world-v6",
  "name": "World v6",
  "description": "Open-licensed World trivia, volume 6. Generated from the OpenTriviaQA archive and capped at 500 logical notes per Deez nut.",
  "authors": [
    {
      "github": "uberspot",
      "name": "OpenTriviaQA contributors"
    },
    {
      "github": "chrisbirster",
      "name": "Chris Birster"
    }
  ],
  "tags": [
    "trivia",
    "open-trivia-qa",
    "world",
    "general-knowledge"
  ],
  "license": "CC-BY-SA-4.0",
  "source": {
    "type": "github",
    "repository": "chrisbirster/deez-nuts"
  },
  "versions": [
    {
      "version": "1.0.0",
      "commit": "17c68f4b375f2f8df22bdf091c97b7e2afd5a73e",
      "path": "nuts/world-v6/world-v6.nut",
      "sha256": "e7cb506b1674887030a013eda8bbe22353a48af10f8162d38933467ef1c698f8"
    }
  ]
}
