{
  "schema_version": 1,
  "slug": "people-v1",
  "name": "People v1",
  "description": "Open-licensed People trivia, volume 1. Generated from the OpenTriviaQA archive and capped at 500 logical notes per Deez nut.",
  "authors": [
    {
      "github": "uberspot",
      "name": "OpenTriviaQA contributors"
    },
    {
      "github": "chrisbirster",
      "name": "Chris Birster"
    }
  ],
  "tags": [
    "trivia",
    "open-trivia-qa",
    "people"
  ],
  "license": "CC-BY-SA-4.0",
  "source": {
    "type": "github",
    "repository": "chrisbirster/deez-nuts"
  },
  "versions": [
    {
      "version": "1.0.0",
      "commit": "17c68f4b375f2f8df22bdf091c97b7e2afd5a73e",
      "path": "nuts/people-v1/people-v1.nut",
      "sha256": "fb259326f2dd33739ed048894079104b88af83f4cd1e5ec81b57c7641c5e9e6d"
    }
  ]
}
