{
  "schema_version": 1,
  "slug": "general-v4",
  "name": "General Knowledge v4",
  "description": "Open-licensed General trivia, volume 4. Generated from the OpenTriviaQA archive and capped at 500 logical notes per Deez nut.",
  "authors": [
    {
      "github": "uberspot",
      "name": "OpenTriviaQA contributors"
    },
    {
      "github": "chrisbirster",
      "name": "Chris Birster"
    }
  ],
  "tags": [
    "trivia",
    "open-trivia-qa",
    "general-knowledge"
  ],
  "license": "CC-BY-SA-4.0",
  "source": {
    "type": "github",
    "repository": "chrisbirster/deez-nuts"
  },
  "versions": [
    {
      "version": "1.0.0",
      "commit": "17c68f4b375f2f8df22bdf091c97b7e2afd5a73e",
      "path": "nuts/general-v4/general-v4.nut",
      "sha256": "89d673aefca6789163997b06d70a5adba4e0e227a87a9da94d6b891cf21632cf"
    }
  ]
}
