{
  "schema_version": 1,
  "slug": "humanities-v1",
  "name": "Humanities v1",
  "description": "Open-licensed Humanities trivia, volume 1. Generated from the OpenTriviaQA archive and capped at 500 logical notes per Deez nut.",
  "authors": [
    {
      "github": "uberspot",
      "name": "OpenTriviaQA contributors"
    },
    {
      "github": "chrisbirster",
      "name": "Chris Birster"
    }
  ],
  "tags": [
    "trivia",
    "open-trivia-qa",
    "humanities"
  ],
  "license": "CC-BY-SA-4.0",
  "source": {
    "type": "github",
    "repository": "chrisbirster/deez-nuts"
  },
  "versions": [
    {
      "version": "1.0.0",
      "commit": "17c68f4b375f2f8df22bdf091c97b7e2afd5a73e",
      "path": "nuts/humanities-v1/humanities-v1.nut",
      "sha256": "8f3e200850bc4387ad3b6baff3afec1ebc0a0214d4ad6e7d0f2d5c77b81a4151"
    }
  ]
}
