{
  "schema_version": 1,
  "slug": "video-games-v1",
  "name": "Video Games v1",
  "description": "Open-licensed Video Games trivia, volume 1. Generated from the OpenTriviaQA archive and capped at 500 logical notes per Deez nut.",
  "authors": [
    {
      "github": "uberspot",
      "name": "OpenTriviaQA contributors"
    },
    {
      "github": "chrisbirster",
      "name": "Chris Birster"
    }
  ],
  "tags": [
    "trivia",
    "open-trivia-qa",
    "video-games",
    "gaming"
  ],
  "license": "CC-BY-SA-4.0",
  "source": {
    "type": "github",
    "repository": "chrisbirster/deez-nuts"
  },
  "versions": [
    {
      "version": "1.0.0",
      "commit": "17c68f4b375f2f8df22bdf091c97b7e2afd5a73e",
      "path": "nuts/video-games-v1/video-games-v1.nut",
      "sha256": "0fe809711d286ca23c8160f69f8880d6de88bc6e901da69caf0ef4374b58a004"
    }
  ]
}
