{
  "schema_version": 1,
  "slug": "religion-faith-v1",
  "name": "Religion & Faith v1",
  "description": "Open-licensed Religion Faith trivia, volume 1. Generated from the OpenTriviaQA archive and capped at 500 logical notes per Deez nut.",
  "authors": [
    {
      "github": "uberspot",
      "name": "OpenTriviaQA contributors"
    },
    {
      "github": "chrisbirster",
      "name": "Chris Birster"
    }
  ],
  "tags": [
    "trivia",
    "open-trivia-qa",
    "religion",
    "faith"
  ],
  "license": "CC-BY-SA-4.0",
  "source": {
    "type": "github",
    "repository": "chrisbirster/deez-nuts"
  },
  "versions": [
    {
      "version": "1.0.0",
      "commit": "17c68f4b375f2f8df22bdf091c97b7e2afd5a73e",
      "path": "nuts/religion-faith-v1/religion-faith-v1.nut",
      "sha256": "440ff2b70989e2561976b65a11fb3272d2c54b9b15f78416b45538a803a71a49"
    }
  ]
}
