{
  "schema_version": 1,
  "slug": "music-v8",
  "name": "Music v8",
  "description": "Open-licensed Music trivia, volume 8. Generated from the OpenTriviaQA archive and capped at 500 logical notes per Deez nut.",
  "authors": [
    {
      "github": "uberspot",
      "name": "OpenTriviaQA contributors"
    },
    {
      "github": "chrisbirster",
      "name": "Chris Birster"
    }
  ],
  "tags": [
    "trivia",
    "open-trivia-qa",
    "music",
    "pop-culture"
  ],
  "license": "CC-BY-SA-4.0",
  "source": {
    "type": "github",
    "repository": "chrisbirster/deez-nuts"
  },
  "versions": [
    {
      "version": "1.0.0",
      "commit": "17c68f4b375f2f8df22bdf091c97b7e2afd5a73e",
      "path": "nuts/music-v8/music-v8.nut",
      "sha256": "c3e3138462138b69b986081411aad9c1e0e750140a5dc1e1f1449b0e1c36664e"
    }
  ]
}
