{
  "schema_version": 1,
  "slug": "sports-v1",
  "name": "Sports v1",
  "description": "Open-licensed Sports trivia, volume 1. Generated from the OpenTriviaQA archive and capped at 500 logical notes per Deez nut.",
  "authors": [
    {
      "github": "uberspot",
      "name": "OpenTriviaQA contributors"
    },
    {
      "github": "chrisbirster",
      "name": "Chris Birster"
    }
  ],
  "tags": [
    "trivia",
    "open-trivia-qa",
    "sports"
  ],
  "license": "CC-BY-SA-4.0",
  "source": {
    "type": "github",
    "repository": "chrisbirster/deez-nuts"
  },
  "versions": [
    {
      "version": "1.0.0",
      "commit": "17c68f4b375f2f8df22bdf091c97b7e2afd5a73e",
      "path": "nuts/sports-v1/sports-v1.nut",
      "sha256": "9e20f8e9a825c07bdd9eef7c644512c016f34d7f1b7a795e094a0ad74baebacc"
    }
  ]
}
