{
  "schema_version": 1,
  "slug": "brain-teasers-v1",
  "name": "Brain Teasers v1",
  "description": "Open-licensed Brain Teasers trivia, volume 1. Generated from the OpenTriviaQA archive and capped at 500 logical notes per Deez nut.",
  "authors": [
    {
      "github": "uberspot",
      "name": "OpenTriviaQA contributors"
    },
    {
      "github": "chrisbirster",
      "name": "Chris Birster"
    }
  ],
  "tags": [
    "trivia",
    "open-trivia-qa",
    "brain-teasers"
  ],
  "license": "CC-BY-SA-4.0",
  "source": {
    "type": "github",
    "repository": "chrisbirster/deez-nuts"
  },
  "versions": [
    {
      "version": "1.0.0",
      "commit": "17c68f4b375f2f8df22bdf091c97b7e2afd5a73e",
      "path": "nuts/brain-teasers-v1/brain-teasers-v1.nut",
      "sha256": "3bc111c9e3a54dde425aaa9702033f3d05ec5a49a4208afc187052c32054dcf9"
    }
  ]
}
